id,title,text,url,image,publish_date,author,language,source_country,sentiment
139723339,Managing Obsolescence And Supply Chain Disruption,"MANAGING OBSOLESCENCE AND SUPPLY CHAIN DISRUPTION By Neil Ballinger, Head of Global Operations, EU Automation The early 21st century has seen global supply chain disruption on an unprecedented scale. The recent pandemic may have abated, but its aftershocks are still being felt by manufacturers and industrial automation engineers around the world. Microchip shortages and skills shortfalls are now being compounded by rising energy costs and soaring inflation. Geopolitics is leading to more complex trading conditions and tariffs. In addition, the rapid evolution of disruptive new technologies like Artificial Intelligence (AI) is accelerating component obsolescence. What is the role of supply chain management? For businesses to thrive in such challenging conditions, it is essential to have a supply chain that is sufficiently robust and agile enough to weather the storms of market adversity and respond to new opportunities. Supply chain management is essentially about managing risk. It relies on lifecycle forecasting to identify the impact of failure or obsolescence on the business. Identifying risks allows you to develop planned, preventative actions for when parts, spares and software fail or become obsolete. What are the consequences of poor supply chain management? The inability to source and replace critical parts efficiently results in loss of production capacity, a significant increase in lifecycle costs, reduced credibility with customers, lower profitability, and loss of reputation. By contrast, a company that has a robust supply chain management strategy in place is likely to have a preventative maintenance plan that guarantees minimal downtime, ready access to a stock of parts requiring frequent replacement, and the ability to offer its customers guarantees around availability and delivery times, which gives it a competitive edge. What are the fundamentals of good supply chain management? Know your strengths and weaknesses. Take the time to assess your systems and predict what components may need replacing, and when. And what about your people? If your supply chain manager was off sick or left the company, what impact would that have on the business? Have a plan to manage the risks. Planning ahead rather than reacting to failures gives you a competitive advantage over around three quarters of your rivals! Use suppliers you can trust. Suppliers with a proven track record of supporting products are the bedrock of good supply chain management. It also helps to avoid fitting sub-standard parts, whose poor quality could lead to more unplanned downtime. Do I have the capacity to develop my own supply chain strategy? Supply chain management involves a multi-disciplinary approach and requires considerable time to get right, so be absolutely sure you have what it takes. Can you develop your own dedicated global network of credible, verified suppliers? And can you do that for every Manufacturer group you’ll ever need today and in the future?Do you have inhouse experts in the fields of legislation, electrical compatibility, import and export documentation and international certifications, as well as those working on the logistics and maintenance side, to cover all supply chain aspects?If your machines are older, do you also need a dedicated Obsolescence Manager to track down and secure parts that are no longer available?Can you continuously maintain up-to-date records of all your components and where to source them? Also, be aware that the price of failure can be very high. In addition to the ongoing cost of supporting an internal supply chain function, calculate the likely cost in lost production, in the wages of employees sitting idle and lost reputation with customers if your supply chain processes should fail before making your decision. If you have all the expertise and resources available, then proceed to build and manage your own supply chain. For those businesses who find that on balance internal supply chain management is not feasible there is the option to outsource the function to an external specialist. What are the benefits of working with an external supply chain partner? External specialists like EU Automation support businesses by acting as their supply chain management function. For example, as a global distributor of automation parts we specialise in the procurement of essential and scarce components through a global supply network of more than 100 parts manufacturers. We use our expert knowledge and extensive procurement contacts to source and deliver the parts our customers need in order to minimise disruption and keep their production lines running. We recently helped an Australian pharmaceutical customer to track down a critical but obsolete central processing unit. He travelled by aeroplane to our Frankfurt hub to collect it. While in transit, he was told a second unit had failed. We managed to source a second unit too, and had both of them ready to hand over when he arrived. We also helped to arrange his accommodation and return flight. His business was up and running again 72 hours later, saving thousands of dollars. External supply chain partners can also add value by anticipating wider threats and opportunities. For example, cybersecurity is a growing concern. The UK government famously banned Huawei from its 5G network development due to supply chain and security issues. As manufacturing becomes more connected, new risks arise. EU Automation helps businesses keep their hardware and software up to date to minimise the risk of cyber-attacks. We have robust systems in place for traceability: so our customers can be confident that they are sourcing quality parts with full warranties, minimising risk. Sustainability is also growing in importance. The traditional linear approach of make, use and dispose is no longer acceptable, so businesses need to find ways they can demonstrably support a circular economy. Supply chain management can make a significant contribution. When an industrial plant closes, it contains hundreds, if not thousands, of useful working parts: some of which are no longer manufactured. As part of our own commitment to recycle and reuse, we provide a way for businesses to access and purchase these parts once they’ve been reconditioned, extending the lifecycle of their machines and reducing waste. What is the future of supply chain management? The uncertainties that have disrupted supply chains in recent years will take time to dissipate, but manufacturers can expect to see a return to proven just-in-time methods for general wear and tear parts soon, with only critical spares being held on site. In future, it is likely that the rate of obsolescence will accelerate, driven by rapid developments in connective technologies. This may also lead to an increase in supply chain outsourcing to take advantage of the agility, resources and expertise inherent in companies dedicated to the task. EU Automation is well-placed to support businesses through any supply chain challenges. We have a dedicated database of globally available stock (new, second-hand and scarce), together with latest pricing information and lead-in times. Customers can access the parts they require via our committed team of account managers, who provide efficient local support in the relevant native language. Together, our global supply network and local support offices give reassurance that, if the unexpected does occur, we have the people and the processes in place to source the part you need to keep your business running. CLICK HERE FOR LATEST NEWS. READ CURRENT AND PAST ISSUES OF IAA. KEEP YOURSELF UPDATED, SUBSCRIBE TO IAA NOW! AND DON’T FORGET FOLLOW US ON FACEBOOK, LINKEDIN AND TWITTER!",https://www.iaasiaonline.com/managing-obsolescence-and-supply-chain-disruption/,https://www.iaasiaonline.com/wp-content/uploads/2023/08/Warehouse-1-1-scaled.jpg,2023-08-28 19:34:18,Neil Ballinger,en,sg,0.211
142005631,Import and Export of Temperature Sensitive Products to Propel Cold Chain Packaging Demand at US$ 103.7 Billion by 2033,"Germany's cold chain packaging market is set to expand 3.6x by 2033, propelled by its leading position in European and global pharmaceutical markets NEWARK, DELAWARE, UNITED STATES, September 7, 2023/EINPresswire.com/ -- The Cold Chain Packaging Market is a crucial segment within the global logistics and supply chain industry. It plays a pivotal role in preserving the integrity of temperature-sensitive products during transportation and storage. This market has been witnessing significant growth due to several factors. One key driver is the increasing demand for pharmaceuticals and biotechnology products that require strict temperature control to maintain their efficacy. As the pharmaceutical and biotech sectors continue to expand, so does the need for reliable cold-chain packaging solutions. In 2023, it is predicted that the market for cold chain packaging will reach US$ 26.1 billion. It is estimated to continue expanding between 2023 and 2033 at a CAGR of 14.8%. In 2033, the market is projected to be worth more than US$ 103.7 billion. Pharmaceutical products that seem to be temperature sensitive should be safeguarded throughout shipping against rough handling, harsh weather, and other unforeseen circumstances. They need to be maintained with a stable temperature range. Request our sample report and gain a competitive advantage in this flourishing industry! https://www.futuremarketinsights.com/reports/sample/rep-gb-12906 Pharmaceuticals have a complicated supply chain that necessitates attention to numerous small aspects during transit and delivery. Pharmaceutical supplies must be transported to warehouses at specific temperatures. They must also be properly assembled and sorted before being delivered to the appropriate pharmacies. Adopting cold chain packaging solutions for the transportation of temperature-sensitive goods allows for flexibility in routing and simplicity in handling. It can also reduce the risk of transit-related damage. Numerous companies are set to launch different types of measures to track vaccine waste at the national level. These initiatives concentrate on the safe handling and delivery of vaccines. Third-party logistics service providers have adopted several cold chain packaging solutions as a result, thereby boosting the market. The global pharmaceuticals sector is expanding quickly as a result of rapid globalization and the development of low-cost medications. Government agencies from all over the world are urging individuals to shift to generic medications and bio-equivalent pharmaceuticals. This is mainly taking pace as they are substantially less expensive but still necessitate cold chain packaging and transportation. Key Takeaways of the Cold Chain Packaging Market Insulated containers segment by product type is anticipated to hold more than 1/3rd of the cold chain packaging market share by 2023. Reusable packaging formats are projected to exhibit a CAGR of 0% between 2023 and 2033. Polymer segment by material type is likely to account for around 3/5th of the cold chain packaging market share in 2033. By end user, the food segment is estimated to create an incremental opportunity of US$ 17 billion in the forecast period. Germany's cold chain packaging market is likely to surge 6 times its present rate in the assessment period. “Lightweight shippers that provide high volume efficiency tend to offer financial benefits such as low transportation cost due to low shipping weight. To reduce overall cost, manufacturers should select shippers with high payload capacity. Reusable cold chain packaging helps in reducing cost per use and enhances profitability margins for manufacturers,” says a lead analyst at Future Market Insights. Request Methodology to Get a Comprehensive View of the Cold Chain Packaging Market! https://www.futuremarketinsights.com/request-report-methodology/rep-gb-12906 Efficient Pallet Shippers to Become an Ideal Choice for Manufacturers to Fulfil Ultra Low-Temperature Requirements Numerous pharmaceutical treatments designed to treat uncommon diseases frequently contain valuable components with a limited shelf life. They also contain severe temperature specifications such as a temperature range of -40 to -150 degrees Celsius. Demand for pallet shippers that provide safe delivery of such materials is hence anticipated to increase as the use of medicinal products with ultra-low temperature ranges increases. Businesses can take advantage of this opportunity to the fullest by creating packaging options tailored to this product category and gain a sizable competitive edge. Pallet shippers are traditional heavy-duty metal boxes that are actively handled and have substantial transportation issues for lengthy multi-modal routes. They are utilized for air freight shipping. Nevertheless, numerous businesses have recently released passive pallet shippers that make use of high-density polyurethane insulation technology. For bulk shipments, this results in convenience, dependability, and value. Key cold chain packaging solution providers have a great chance in this market to produce effective passive pallet shippers as active competitors are expensive and insufficient for remote transportation needs. Expansion of Rental Businesses to Create New Opportunities for Cold Chain Packaging Companies The market has recently seen a trend where companies offering cold chain packaging solutions are rapidly broadening their rental business. They are relatively less focused on new product sales. Purchasing these still constitutes an unfeasible and environmentally unsound option for numerous end users. This is due to the high costs of insulated containers and shippers, as well as environmental risks associated with their disposal. In a few nations, especially Germany, it is illegal to dispose of expanded polystyrene and polyurethane rigid foam. Doing so incurs additional costs. For cold chain packaging, a variety of end users choose to lease or rent shippers or containers. Manufacturers of shippers and containers, on the other hand, experience high returns on their investments and low cost of ownership. It can lead to high profit margins. But, this technique is still not cost-effective unless a business has a closed-loop system. Establishing depots in numerous areas is necessary for the firm to succeed. For instance, Together along with Yusen Logistics Pte. Ltd., Va-Q-tec AG developed a temperature-controlled container leasing facility in Singapore. Credo on demand is indeed a pallet shipper renting program that was established by Pelican Biothermal. Competition Landscape: Cold Chain Packaging Market Sonoco ThermoSafe, Pelican Products, Inc., Sofrigam SAS, Sealed Air Corporation, Cryopak Industries Inc., and CSafe Global, LLC are key players operating in the cold chain packaging market. Few of the other noticeable players in the market include Softbox Systems Ltd., TOWER Cold Chain Solutions, DGP Intelsius LLC, TemperPack Technologies, Inc., Tempack Packaging Solutions SL, Dokasch Temperature Solutions, Cold Chain Technologies, Insulated Products Corporation., Engineered Packaging, Inc. dba Chill-Pak, CoolPac, Orora Packaging Solutions, and others. Ronak Shah Future Market Insights, Inc. +1 845-579-5705 email us here Visit us on social media: Facebook Twitter LinkedIn YouTube",https://kalkinemedia.com/news/world-news/import-and-export-of-temperature-sensitive-products-to-propel-cold-chain-packaging-demand-at-us-1037-billion-by-2033,https://kalkinemedia.com/storage/uploads/large/1694088033_64f9bb617b610_www.einpresswire.com,2023-09-07 14:06:58,EIN Presswire,en,au,0.34500000000000003
143051103,Supply Chain Finance Market Size 2023: Expeditious Growth Expected in Coming Years,"PORTLAND, OREGAON, UNITED STATES, September 11, 2023/EINPresswire.com/ -- The research on the growth of the ""Supply Chain Finance Market"" from 2023 to 2030 offers valuable insights into present trends, hurdles, market risks, and limitations faced by key vendors. This comprehensive report encompasses geographical segmentation, current demand trends, in-depth growth rate analysis, industry revenue, and a detailed examination of the Compound Annual Growth Rate (CAGR). Additionally, this report on the Supply Chain Finance market delivers both qualitative and quantitative analyses, including company profiles, investment prospects, strategic development strategies, industry size, and global market share assessments. According to the report published by Allied Market Research, the global supply chain finance market generated $6 billion in 2021, and is projected to reach $13.4 billion by 2031, growing at a CAGR of 8.8% from 2022 to 2031. The report offers a detailed analysis of the top winning strategies, evolving market trends, market size and estimations, value chain, key investment pockets, drivers & opportunities, competitive landscape, and regional landscape. The report is a useful source of information for new entrants, shareholders, frontrunners, and shareholders in introducing necessary strategies for the future and taking essential steps to significantly strengthen and heighten their position in the market. Download Sample Report @ https://www.alliedmarketresearch.com/request-sample/8552 COVID-19 Scenario: The outbreak of the COVID-19 pandemic had negatively impacted the growth of the global supply chain finance market, owing to surge in remote working activities creating the daunting task of capturing data from many locations and sources for the supply chain finance firms.The COVID-19 pandemic substantially enhanced the demand for new technologies including electronic invoicing, artificial intelligence, smartphone and mobile internet access, and blockchain in business transactions, which propelled the growth of the global market. Interested to Procure the Data? Inquire Here@ https://www.alliedmarketresearch.com/purchase-enquiry/8552 The report offers a detailed segmentation of the global supply chain finance market based on offering, provider, application, end user, and region. The report provides a comprehensive analysis of every segment and their respective sub-segment with the help of graphical and tabular representation. This analysis can essentially help market players, investors, and new entrants in determining and devising strategies based on the fastest-growing segments and highest revenue generation that is mentioned in the report. Based on offering, the export and import bills segment held the major market share in 2021, holding nearly two-fifths of the global supply chain finance market share, and is expected to maintain its leadership status during the forecast period. However, the shipping guarantees segment, is expected to cite the fastest CAGR of 13.1% during the forecast period. On the basis of provider, the banks segment held the largest market share in 2021, accounting for nearly 90% of the global supply chain finance market share, and is expected to maintain its leadership status during the forecast period. Nevertheless, the trade finance house segment, is expected to cite the highest CAGR of 14.2% during the forecast period. In terms of application, the domestic segment held the major market share in 2021, contributing to nearly fourth-fifths of the global supply chain finance market share, and is expected to maintain its leadership position during the forecast period. However, the international segment, is expected to cite the fastest CAGR of 11.6% during the forecast period. Based on end user, the large enterprises segment held the major market share in 2021, contributing to nearly two-thirds of the global supply chain finance market share, and is expected to maintain its leadership position during the forecast period. However, the small and medium-sized enterprises segment, is expected to cite the fastest CAGR of 11.2% during the forecast period. Region-wise, the Asia-Pacific region held the major market share in 2021, holding over two-fifths of the global supply chain finance market share and is expected to maintain its leadership status during the forecast period. Moreover, the same segment is expected to cite the fastest CAGR of 11.5% during the forecast period. The report also analyses other regions such as North America, Europe, and LAMEA. The key players analyzed in the global supply chain finance market report include Asian Development Bank, BNP Paribas Group, Bank of America Corporation, Citigroup, Inc., Eulers Herms (Allianz Trade), HSBC Group, JPMorgan Chase & Co., Mitsubishi UFJ Financial Group, Inc., Royal Bank of Scotland plc, and Standard Chartered plc. The report analyzes these key players in the global supply chain finance market. These market players have made effective use of strategies such as joint ventures, collaborations, expansion, new product launches, partnerships, and others to maximize their foothold and prowess in the industry. The report is helpful in analyzing recent developments, product portfolio, business performance, and operating segments by prominent players in the market. KEY BENEFITS FOR STAKEHOLDERS This report provides a quantitative analysis of the market segments, current trends, estimations, and dynamics of the data analytics in banking market analysis from 2021 to 2031 to identify the prevailing supply chain finance market opportunity. The market research is offered along with information related to key drivers, restraints, and opportunities in the supply chain finance market forecast. Porter's five forces analysis highlights the potency of buyers and suppliers to enable stakeholders make profit-oriented business decisions and strengthen their supplier-buyer network. In-depth analysis of the supply chain finance market segmentation assists to determine the prevailing market opportunities. Major countries in each region are mapped according to their revenue contribution to the global market. Market player positioning facilitates benchmarking and provides a clear understanding of the present position of the market players. The report includes the analysis of the regional as well as global supply chain finance market trends, key players, market segments, application areas, and market growth strategies. Key Market Segments Offering Export and Import BillsLetter of CreditPerformance BondsShipping GuaranteesOthers Provider BanksTrade Finance HouseOthers Application DomesticInternational End User Large EnterprisesSmall and Medium-sized Enterprises By Region North America (U.S., Canada)Europe (Germany, France, UK, Italy, Spain, Rest of Europe)Asia-Pacific (China, Japan, India, Australia, South Korea, Rest of Asia-Pacific)LAMEA (Latin America, Middle East, Africa)Buy This Research Report – https://bit.ly/3WHy9GB Trending Reports in BFSI Industry Bank Kiosk Market https://www.alliedmarketresearch.com/bank-kiosk-market-A16954Digital Remittance Market https://www.alliedmarketresearch.com/digital-remittance-marketBalanced Funds Market https://www.alliedmarketresearch.com/balanced-funds-market-A16645Supply Chain Finance Market https://www.alliedmarketresearch.com/supply-chain-finance-market-A08187AI in Fintech Market https://www.alliedmarketresearch.com/ai-in-fintech-market-A16644 About Us: Allied Market Research (AMR) is a full-service market research and business-consulting wing of Allied Analytics LLP based in Portland, Oregon. Allied Market Research provides global enterprises as well as medium and small businesses with unmatched quality of ""Market Research Reports"" and ""Business Intelligence Solutions."" AMR has a targeted view to provide business insights and consulting to assist its clients to make strategic business decisions and achieve sustainable growth in their respective market domain. David Correa Allied Analytics LLP +1 800-792-5285 email us here Visit us on social media: Facebook Twitter LinkedIn",https://kalkinemedia.com/news/world-news/supply-chain-finance-market-size-2023-expeditious-growth-expected-in-coming-years-allied-market-research,https://kalkinemedia.com/storage/uploads/large/1694429118_64feefbe00dbd_18855197_supply_chain_finance_market_ana_847x516.png,2023-09-11 12:59:00,EIN Presswire,en,au,0.423
