id,title,text,url,image,publish_date,author,language,source_country,sentiment
143100089,Investors Pressure Nike On Wages Allegedly Owed To Factory Workers - WorldNewsEra,"Youth activists who lined the streets of Nairobi last week to call for an end to major fossil fuel projects in Africa did not have much of a say in the agenda of the continent’s first climate summit. “The African climate summit wasn’t as much of a space for us Africans as we expected,” said Hilda Flavia Nakabuye, a 26-year-old climate activist who founded Uganda’s Fridays for Future movement. It was “absurd” that the summit’s host Kenyan president William Ruto did not demand more payments from the Global North “for the years of devastation they have caused on our lands”, she added. If Nakabuye had been in charge, three demands would have figured more prominently: phasing out fossil fuel production, asking western creditors to cancel debts and calling on rich countries to follow through on their repeatedly broken promise to provide more than $100bn a year for climate action in poorer countries. While activists may have felt sidelined, the urgent tone of their requests was echoed by the dozens of African ministers and institutions who called on western business, finance and lawmakers to do better by Africa. Over the weekend, world leaders at the G20 summit appeared to heed this call, agreeing to elevate the African Union to a full member of the group and calling for the World Bank to better serve low-income countries. Please read on for my story on what the business and finance world can learn from the Nairobi summit. But first, Oliver Telling breaks the news of an investor letter to Nike ahead of its general meeting tomorrow, calling on the company to resolve alleged human rights breaches in Asia. (Kenza Bryan) Nike investors dial up pressure on worker rights Earlier this year, we reported that unions and non-profit groups were taking Nike to task, alleging that its Asian suppliers had not paid money owed to workers during the Covid-19 pandemic. Now investors have entered the fray. Investors including $244bn Dutch pension fund PGGM last week sent a letter to Nike demanding that the sportswear giant “fulfil its human rights responsibilities”, calling on the company to ensure workers are paid millions of dollars that they are allegedly owed in wages and severance pay. The letter, which has not previously been reported, cites a study by investigative non-profit group Worker Rights Consortium that found 1,284 workers were dismissed in 2020 from one Cambodia factory, subcontracted by the Ramatex group, without receiving the remuneration they were entitled to. It also claims that workers at one Thai manufacturer, Hong Seng Knitting, have not been paid wages owed to them during a factory shutdown that year. Nike did not respond to a request for comment. It previously told WRC that an independent investigation found no evidence of its products being produced at the Cambodia factory in recent years, according to the campaign group. WRC also said it was told by Nike that internal and third-party investigations found no evidence that Hong Seng Knitting forced employees to take unpaid leave. The escalating pressure on the apparel company underlines ongoing concerns over the income lost by low-paid Asian factory workers during the health crisis, when economies went into lockdown and major western brands cancelled swaths of orders. The investors have not explicitly accused Nike itself of withdrawing orders. But their campaign also adds to warnings that multinationals should be taking greater responsibility for potential misconduct by their suppliers, amid growing regulatory pressure to monitor their supply chains. Decades after big brands started outsourcing production to Asia to save on labour costs, investors fear a lack of oversight is becoming a significant business risk. “It’s important that companies are preparing themselves,” said Richard Kooloos, head of social impact at Dutch bank ABN Amro, which signed the letter to Nike. “Companies prepared for future legislation are more robust, more future-proof and more stable for shareholders.” This year, a non-profit group submitted a complaint against three of Germany’s top carmakers, accusing them of using forced labour in their Chinese supply chains under a new law that penalises companies for failing to address human rights issues involving their suppliers. As companies face the growing risk of such cases, Kooloos warned that the business world was now “moving from a period of principles to a period of hard law”. He pointed to proposals in upcoming EU legislation that would require companies to ensure those affected by misconduct in their value chains have access to legal remedy. It is unclear whether the investors will force Nike to rethink its position. ABN Amro declined to reveal the size of its clients’ holdings in Nike and does not intend to restrict investments in the company. Only five financial groups have at present backed the campaign, according to people close to the efforts. But those involved are urging more to join as the company prepares for its annual general meeting tomorrow. They are calling on Nike to ensure that the workers affected are collectively paid $2.2mn. The US group reported a profit before tax of $6.2bn for the year to May. Elsewhere, it has been a good year for the Nike brand: film-goers flocked to see Air, an affectionate depiction of Nike employees in Oregon inventing the Air Jordan sneaker. The campaign on labour rights is yet to significantly dent the company’s image. But activists are hoping that the latest intervention by investors will draw more attention to the workers that Nike depends on, many miles away in Asia. (Oliver Telling with additional reporting by Arjun Neil Alim) This article has been amended to clarify that investors are calling on Nike to ensure that the workers affected are collectively paid $2.2mn, not $3.2mn as previously stated. ‘The finance gap is staggering: it’s trillions’ Global corporate and financial executives would have done well to pay attention to the goings-on last week in Nairobi, where discussions at the Africa Climate Week gathering revealed some interesting new investment opportunities for the business world. “The financing gap is staggering, it’s trillions, but you don’t hear about trillions coming into the continent, it’s just trickling in,” Hassatou Diop N’Sele, vice-president of the African Development Bank (AfDB), told Moral Money after dozens of African leaders and US climate envoy John Kerry had set off on planes home. “We feel the urgency but we just don’t have the resources.” As awareness of this financing gap grows, so too do chances to invest in Africa through public-private partnerships, with multilateral banks, states and philanthropic organisations taking on the biggest risk. A major aim of the three-day gathering was drawing in capital to fund clean energy and climate adaptation projects on the continent. Attendees pledged a combined $26bn in climate finance deals, including $15mn from the UK to mobilise climate finance from private sources, and €1bn ($1.07bn) from the EU to de-risk private investments into Africa. Green hydrogen, made using renewable energy, was a particular focus. Germany pledged €60mn for green hydrogen production to make fertiliser, while Hydrogène de France said it would invest $500mn in Kenya’s first green hydrogen power plant. And much bigger sources of risk capital for clean energy could soon be unlocked. One of the most tantalising is the $100bn in IMF funds (known as special drawing rights) that richer countries had promised in 2021 to redistribute to countries most in need. The AfDB’s Diop N’Sele told Moral Money that the summit yielded positive discussions with five major holders of this capital, over the possibility of the bank receiving these funds and allocating them itself to projects on the continent. It claims it could leverage each dollar into four dollars of low-cost loans to projects based in Africa. Another potential source of risk capital, export credit agencies, are under increasing pressure from their national governments to support climate deals, according to Irene Visser, head of strategy and international relations at the Dutch export credit agency Atradius DSB. Last year the agency invested €320mn in de-risking deals on the continent, and has supported start-ups including Spark, an off-grid solar company. Opportunities for green bond investors, who have had few chances to invest in Africa so far, also appear to be growing. The continent has been behind in sustainable debt issuances, in part because obtaining second-party opinions on the quality of green debt and marketing it to sustainable investors can be costly. But the EU promised at the summit to help shore up Africa’s green bond market by sharing expertise through the Global Green Bond Initiative. Tanzania’s largest bank CRDB announced a $300mn green raise ahead of the summit, the largest in sub-Saharan Africa. About 40 per cent of this will be bought by the International Finance Corporation, the investment arm of the World Bank. Barriers to investment remain, in particular the challenge of supporting smaller clean energy projects, which cannot tap bond markets and struggle to attract risk capital from multilateral development banks or export credit agencies, according to Mark Napier, chief executive of the British-government funded agency FSD Africa, which promotes financial sector development. These challenges mean that some see local capital, not foreign, as the long-term solution. Just $830mn of domestic institutional and banking capital in Africa is invested in climate solutions and clean energy, a fraction of the $1.4tn assets managed by local institutions including pension funds, insurers and sovereign wealth funds, according to FSD Africa and Climate Policy Initiative estimates. Enthusiasm for government securities, perceived to be low-risk, comes at the expense of investment in the private sector, according to Napier. FSD Africa has worked on creating private debt instruments which channel African insurance money into renewable energy projects. A similar model could be used to funnel institutional money from western sources into a mosaic of small projects. (Kenza Bryan) Smart reads G20 leaders are facing criticism after their weekend summit in India brought a pledge only to a “phasedown” of coal “in line with national circumstances”, with no reference to a phaseout of all fossil fuel usage. BlackRock and MFS Investment Management both voted against mining company Glencore’s climate plan earlier this year, new disclosures reveal.",https://worldnewsera.com/news/finance/stock-market/investors-pressure-nike-on-wages-allegedly-owed-to-factory-workers/,https://www.ft.com/__origami/service/image/v2/images/raw/https://d1e00ek4ebabms.cloudfront.net/production/b400dc5c-a015-4a7d-ac94-57bd822f4765.jpg,2023-09-11 16:55:30,Arjun Neil Alim,en,us,-0.224
143997037,N.W.T. store shelves filling up again after wildfires disrupted supply chain,"When Yellowknife's evacuation order went out last month, city residents had until noon on Friday, Aug. 18, to leave the capital. That Friday, Yellowknife Co-op manager Justin Nelson said his store was packed with shoppers from nearby Behchokǫ̀, filling their carts with weeks' worth of groceries. The Behchokǫ̀ shoppers were preparing for what would be a supply chain disruption that soon left some N.W.T. communities with empty grocery shelves and skyrocketing prices as freight came from Edmonton rather than the evacuated N.W.T. capital. ""They were the longest lines I've ever seen in the store,"" Nelson said of that busy Friday. Now that Yellowknifers are returning home and services returning with them, food retailers in the territory say their formerly barren shelves are stocked once more and that government programs are helping offset some of their additional costs. Dave Dyment is the general manager at the Délı̨nę Co-op. He says shelves in his store are once again ""pretty much full,"" but at the start of the month the store was in short supply, if not completely out of, milk, bread, flour, fresh meat, chips and cigarettes. ""It really did create some chaos with our supply chain,"" he said. In Łútselk'e, Co-op manager Joe Yatkowski said the store's regular shipments at their regular costs resumed Friday. Yatkowski had previously described barren shelves and freight shipments billed at ten times their usual price. Normally, he said, Łútselk'e would have received seven flights a week, with about half of them carrying the bulk of their food shipments. Throughout Yellowknife's evacuation, they received six flights total, he said. Yatkowski was so busy this week restocking the store with three planes' worth of supplies that he was only available to respond to CBC News by email. Government supports Nutrition North Canada, a federal program that subsidizes remote communities' costs on certain staple foods, is covering the increased shipping costs for affected retailers in the Northwest Territories. A spokesperson for Crown-Indigenous Relations and Northern Affairs Canada (CIRNAC), the department that administers Nutrition North, said the program covered shipping costs for products like frozen and fresh produce, milk, eggs, baby food as well as fresh and frozen meat, poultry and fish. Spokesperson Matthew Gutsch said Nutrition North would be reimbursing retailers who incurred initial costs. CIRNAC did not respond to questions of whether it would be paying the full price difference between usual shipments from Yellowknife and temporary shipments from Edmonton. Dyment and Yatkowski both said they were informed about an increase in the Nutrition North subsidy but were not aware of details. About 4,500 kilograms of donated food and supplies also arrived in the territory this week to offset the supply disruptions. The territorial government partnered with Toronto-based charity Second Harvest, which is focused on food security. The charity sourced food from producers, processors and retailers across Alberta to deliver about 1,100 kilograms of food each to Behchokǫ̀, Colville Lake, Łútselk'e and Fort Resolution. Winston Rosser with Second Harvest said those communities were selected based on need, and ability to connect with leaders in those communities. Yatkowski said that he isn't involved with the Second Harvest shipments but that he's glad to see the supplies arrive in the community. He said in the coming weeks he plans get everything sorted to access supports that will help with the extra shipping costs. He also said he hopes to make plans in case next year's wildfire season puts them in a similar position.",https://www.cbc.ca/news/canada/north/nwt-supply-chain-disruption-evacuation-1.6966155?cmp=rss,https://i.cbc.ca/1.6966175.1694697157!/fileImage/httpImage/image.jpg_gen/derivatives/16x9_620/yk-co-op.jpg,2023-09-14 19:19:59,Justin Nelson,en,ca,-0.12
137869739,Unicef gives Ministry of Health K13.5bn supplies,"United Nations Children’s Fund (Unicef) has given Ministry of Health K13.5 billion worth of supplies for community health and non-communicable diseases (NCD) screening and immunisation to support immunisation services and holistic healthcare. Speaking in Lilongwe yesterday when she presided over the handover of the supplies, Minister of Health Khumbize Kandodo Chiponda said the donation, which includes refrigerated vans and solar direct drive refrigerators, will help in constructing a fortified and resilient cold chain infrastructure for handling vaccines when fighting diseases. Chiponda (L) appreciates the package She said: ""We have received the donation through Unicef, but with support from the USA and Germany governments. The donation includes three refrigerated vans and solar-powered refrigerators, among others, that will bolster Malawi's health supply chain, ensuring the storage and transport of vaccines with maintained potency."" The minister said other tools in the package, such as bicycles, raincoats, gumboots and phone tablets, will also help health surveillance assistants in improving their outreach and efficiency, especially in remote areas, having come at a time when the ministry and its partners are implementing a series of polio immunisation campaigns in line with recommendations from the Global Polio Eradication Initiative. Unicef country representative Shadrack Omol said the supplies will enable the ministry to strengthen its health systems by providing timely, effective and safe healthcare services to its people. He said the tools will not only help in immediate challenges but will also ensure the ministry's readiness for future health crises. Said Omol: ""Imagine the workers riding bicycles, wearing raincoats, and using tablets to help people even when it rains.” Other items in the package include three refrigerated vans, 280 refrigerators, 6 000 vaccine carriers, and 100 000 water packs dedicated to effective vaccine management, 350 phone tablets to revolutionise real-time data capture and surveillance of immunization efforts.",https://mwnation.com/unicef-gives-ministry-of-health-k13-5bn-supplies/,https://mwnation.com/wp-content/uploads/2023/08/chiponda.jpg,2023-08-22 08:58:05,Nation Online,en,mw,0.438
139775449,《TAIPEI TIMES》 Taiwanese investments shift to ASEAN,"2023/08/30 03:00 NEW DESTINATION: China-bound investment plunged 40.3 percent from 2018 to last year, while investment in ASEAN markets grew 40.9 percent, the economics ministry said By Crystal Hsu / Staff reporter Taiwan’s investment in ASEAN markets in the first half of this year surpassed the volume bound for China, as local firms continued to shift manufacturing bases away from the world’s second-largest economy at clients’ urging to avoid US-China trade frictions, the Ministry of Economic Affairs said yesterday. Approved investments in Southeast Asia reached US$2 billion in the first six months of this year, accounting for 18.1 percent and overtaking China as the No. 1 destination at 17.6 percent, the ministry said in a report. It attributed the changes to a global supply chain realignment and rising Chinese labor costs. The phenomenon became evident in 2018 when China-bound investment shrank by 50 percent to the lowest level since 2010 and plunged another 50 percent in 2019, the ministry said. From 2018 to last year, investment destined for China declined 40.3 percent from the period of 2013 to 2017. At the same time, investment bound for ASEAN markets grew 40.9 percent, the report said. The bulk of investment in ASEAN was in manufacturing facilities, at 38.2 percent, followed by financial and insurance service providers （23.5 percent）, and wholesale and retail operations （22.3 percent）, it said. By contrast, China-bound investment was focused on manufacturing facilities, it added. Major local banks have set up branches in Vietnam, Thailand, Cambodia and elsewhere in Southeast Asia to better serve their Taiwanese clients and take advantage of fast-growing economies in the region. The government has also encouraged investment in ASEAN markets under President Tsai Ing-wen’s （蔡英文） New Southbound Policy to help local companies diversify investment risks. For the past decade, tech companies have increased their investment in ASEAN markets, whereas previously it was non-tech firms focused on the region, the ministry said. Today, electronic component suppliers make up for 27.6 percent, followed by vendors of computers and optical devices at 12.2 percent, textile makers at 8.9 percent and base metal product suppliers at 6.2 percent, it said. In the previous four years, base metal product suppliers accounted for 46.2 percent of investment in the region, far outweighing electronics companies at 24.2 percent, it said. India emerged as another big beneficiary of the global supply chain realignment, with outbound investment from Taiwan soaring more than threefold after the signing of a bilateral trade agreement in 2018, the ministry said. Investment in India this year might challenge the five-year average of US$100 million, it said, as India’s vast population has received increased attention from global technology titans and their suppliers. 新聞來源：TAIPEI TIMES 不用抽 不用搶 現在用APP看新聞 保證天天中獎　 點我下載APP　 按我看活動辦法",https://news.ltn.com.tw/news/focus/breakingnews/4411607,https://img.ltn.com.tw/Upload/news/600/2023/08/29/phptHqtlL.jpg,2023-08-29 21:11:57,Crystal Hsu,en,tw,-0.278
